  1   0.000000  10.0.17.174 -> 255.255.255.255 DB-LSP-DISC 218 Dropbox LAN sync Discovery Protocol
  2   0.000418  10.0.17.174 -> 10.0.255.255 DB-LSP-DISC 218 Dropbox LAN sync Discovery Protocol
  3   0.308051 172.217.10.229 -> 10.0.18.51   TLSv1.2 119 Application Data
  4   0.308328   10.0.18.51 -> 172.217.10.229 TCP 66 60106→443 [ACK] Seq=1 Ack=54 Win=2731 Len=0 TSval=151518913 TSecr=1944696416
  5   0.981366   10.0.18.51 -> 10.0.255.255 UDP 86 Source port: 57621  Destination port: 57621
  6   1.383566   10.0.18.51 -> 172.217.197.189 QUIC 65 CID: 14253689498340221606, Seq: 236
  7   1.397757   52.7.23.87 -> 10.0.18.51   TLSv1.2 515 Application Data
  8   1.397762   52.7.23.87 -> 10.0.18.51   TLSv1.2 104 Application Data
  9   1.397833   10.0.18.51 -> 52.7.23.87   TCP 66 60373→443 [ACK] Seq=1 Ack=450 Win=3783 Len=0 TSval=151520002 TSecr=2374881480
 10   1.397833   10.0.18.51 -> 52.7.23.87   TCP 66 60373→443 [ACK] Seq=1 Ack=488 Win=3782 Len=0 TSval=151520002 TSecr=2374881480
 11   1.398921   52.7.23.87 -> 10.0.18.51   TLSv1.2 505 Application Data
 12   1.398925   52.7.23.87 -> 10.0.18.51   TLSv1.2 114 Application Data
 13   1.398926   52.7.23.87 -> 10.0.18.51   TLSv1.2 104 Application Data
 14   1.398996   10.0.18.51 -> 52.7.23.87   TCP 66 60373→443 [ACK] Seq=1 Ack=927 Win=3783 Len=0 TSval=151520003 TSecr=2374881480
 15   1.398997   10.0.18.51 -> 52.7.23.87   TCP 66 60373→443 [ACK] Seq=1 Ack=975 Win=3782 Len=0 TSval=151520003 TSecr=2374881480
 16   1.399039   10.0.18.51 -> 52.7.23.87   TCP 66 60373→443 [ACK] Seq=1 Ack=1013 Win=3781 Len=0 TSval=151520003 TSecr=2374881480
 17   1.422101 172.217.197.189 -> 10.0.18.51   QUIC 62 CID: 0, Seq: 15
 18   2.681039   10.0.18.51 -> 52.7.23.87   TLSv1.2 198 Application Data
 19   2.682508   10.0.18.51 -> 52.7.23.87   TLSv1.2 198 Application Data
 20   2.698650   52.7.23.87 -> 10.0.18.51   TCP 66 443→60373 [ACK] Seq=1013 Ack=133 Win=853 Len=0 TSval=2374881805 TSecr=151521284
 21   2.715371   52.7.23.87 -> 10.0.18.51   TCP 66 443→60373 [ACK] Seq=1013 Ack=265 Win=853 Len=0 TSval=2374881809 TSecr=151521285
 22   3.686249 AdiEngin_0e:bc:61 -> Broadcast    ARP 56 Who has 10.0.17.91? Tell 10.0.0.1
 23   4.199073 107.178.244.155 -> 10.0.18.51   TLSv1 263 Application Data
 24   4.199077 107.178.244.155 -> 10.0.18.51   TCP 66 443→60617 [FIN, ACK] Seq=198 Ack=1 Win=244 Len=0 TSval=3962680180 TSecr=151462675
 25   4.199077 107.178.244.155 -> 10.0.18.51   TCP 66 [TCP Out-Of-Order] 443→60617 [FIN, ACK] Seq=198 Ack=1 Win=244 Len=0 TSval=3962680214 TSecr=151462675
 26   4.199154   10.0.18.51 -> 107.178.244.155 TCP 66 60617→443 [ACK] Seq=1 Ack=198 Win=2046 Len=0 TSval=151522795 TSecr=3962680180
 27   4.199155   10.0.18.51 -> 107.178.244.155 TCP 66 60617→443 [ACK] Seq=1 Ack=199 Win=2046 Len=0 TSval=151522795 TSecr=3962680180
 28   4.199210   10.0.18.51 -> 107.178.244.155 TCP 66 [TCP Window Update] 60617→443 [ACK] Seq=1 Ack=199 Win=2048 Len=0 TSval=151522795 TSecr=3962680180
 29   4.201504   10.0.18.51 -> 107.178.244.155 TLSv1 103 Encrypted Alert
 30   4.201751   10.0.18.51 -> 107.178.244.155 TCP 66 60617→443 [FIN, ACK] Seq=38 Ack=199 Win=2048 Len=0 TSval=151522797 TSecr=3962680180
 31   4.205656   10.0.18.51 -> 107.178.244.155 TCP 78 60627→443 [SYN, ECN, CWR] Seq=0 Win=65535 Len=0 MSS=1460 WS=64 TSval=151522801 TSecr=0 SACK_PERM=1
 32   4.217867 107.178.244.155 -> 10.0.18.51   TCP 78 [TCP Dup ACK 23#1] 443→60617 [ACK] Seq=199 Ack=1 Win=244 Len=0 TSval=3962680255 TSecr=151522795 SLE=38 SRE=39
 33   4.217938   10.0.18.51 -> 107.178.244.155 TCP 103 [TCP Retransmission] 60617→443 [FIN, PSH, ACK] Seq=1 Ack=199 Win=2048 Len=37 TSval=151522813 TSecr=3962680255
 34   4.219592 107.178.244.155 -> 10.0.18.51   TCP 74 443→60627 [SYN, ACK] Seq=0 Ack=1 Win=60192 Len=0 MSS=1380 SACK_PERM=1 TSval=4105085865 TSecr=151522801 WS=256
 35   4.219667   10.0.18.51 -> 107.178.244.155 TCP 66 60627→443 [ACK] Seq=1 Ack=1 Win=131328 Len=0 TSval=151522814 TSecr=4105085865
 36   4.219844   10.0.18.51 -> 107.178.244.155 SSL 495 Client Hello
 37   4.220744 107.178.244.155 -> 10.0.18.51   TCP 78 443→60617 [ACK] Seq=199 Ack=39 Win=244 Len=0 TSval=3962680258 TSecr=151522797 SLE=38 SRE=39
 38   4.230632   10.0.18.51 -> 104.25.219.21 TCP 54 60605→443 [ACK] Seq=1 Ack=1 Win=32768 Len=0
 39   4.232426 107.178.244.155 -> 10.0.18.51   TCP 66 [TCP Dup ACK 37#1] 443→60617 [ACK] Seq=199 Ack=39 Win=244 Len=0 TSval=3962680270 TSecr=151522797
 40   4.232457   10.0.18.51 -> 107.178.244.155 TCP 54 60617→443 [RST] Seq=39 Win=0 Len=0
 41   4.233167 107.178.244.155 -> 10.0.18.51   TCP 66 443→60627 [ACK] Seq=1 Ack=430 Win=61440 Len=0 TSval=4105085878 TSecr=151522814
 42   4.233673 107.178.244.155 -> 10.0.18.51   TLSv1 242 Server Hello, Change Cipher Spec, Encrypted Handshake Message
 43   4.233702   10.0.18.51 -> 107.178.244.155 TCP 66 60627→443 [ACK] Seq=430 Ack=177 Win=131136 Len=0 TSval=151522826 TSecr=4105085879
 44   4.234043   10.0.18.51 -> 107.178.244.155 TLSv1 460 Change Cipher Spec, Encrypted Handshake Message, Encrypted Handshake Message, Application Data, Application Data
 45   4.236337 104.25.219.21 -> 10.0.18.51   TCP 56 [TCP ACKed unseen segment] 443→60605 [ACK] Seq=1 Ack=2 Win=32 Len=0
 46   4.238028 107.178.244.155 -> 10.0.18.51   TLSv1 263 Application Data
 47   4.238030 107.178.244.155 -> 10.0.18.51   TCP 66 443→60621 [FIN, ACK] Seq=198 Ack=1 Win=244 Len=0 TSval=99219783 TSecr=151502170
 48   4.238086   10.0.18.51 -> 107.178.244.155 TCP 66 60621→443 [ACK] Seq=1 Ack=198 Win=2046 Len=0 TSval=151522829 TSecr=99219783
 49   4.238086   10.0.18.51 -> 107.178.244.155 TCP 66 60621→443 [ACK] Seq=1 Ack=199 Win=2046 Len=0 TSval=151522829 TSecr=99219783
 50   4.239269   10.0.18.51 -> 107.178.244.155 TLSv1 103 Encrypted Alert
 51   4.239400   10.0.18.51 -> 107.178.244.155 TCP 66 60621→443 [FIN, ACK] Seq=38 Ack=199 Win=2048 Len=0 TSval=151522830 TSecr=99219783
 52   4.240258   10.0.18.51 -> 107.178.244.155 TCP 78 60628→443 [SYN, ECN, CWR] Seq=0 Win=65535 Len=0 MSS=1460 WS=64 TSval=151522831 TSecr=0 SACK_PERM=1
 53   4.247414 107.178.244.155 -> 10.0.18.51   TCP 78 [TCP Dup ACK 46#1] 443→60621 [ACK] Seq=199 Ack=1 Win=244 Len=0 TSval=99219792 TSecr=151522829 SLE=38 SRE=39
 54   4.247476   10.0.18.51 -> 107.178.244.155 TCP 103 [TCP Retransmission] 60621→443 [FIN, PSH, ACK] Seq=1 Ack=199 Win=2048 Len=37 TSval=151522838 TSecr=99219792
 55   4.257024 107.178.244.155 -> 10.0.18.51   TCP 56 443→60621 [RST] Seq=199 Win=0 Len=0
 56   4.257905 107.178.244.155 -> 10.0.18.51   TCP 74 443→60628 [SYN, ACK] Seq=0 Ack=1 Win=60192 Len=0 MSS=1380 SACK_PERM=1 TSval=723088264 TSecr=151522831 WS=256
 57   4.257953   10.0.18.51 -> 107.178.244.155 TCP 66 60628→443 [ACK] Seq=1 Ack=1 Win=131328 Len=0 TSval=151522847 TSecr=723088264
 58   4.258045   10.0.18.51 -> 107.178.244.155 SSL 495 Client Hello
 59   4.266262 107.178.244.155 -> 10.0.18.51   TCP 56 443→60621 [RST] Seq=199 Win=0 Len=0
 60   4.276679 107.178.244.155 -> 10.0.18.51   TCP 66 443→60628 [ACK] Seq=1 Ack=430 Win=61440 Len=0 TSval=723088283 TSecr=151522847
 61   4.276682 107.178.244.155 -> 10.0.18.51   TCP 66 [TCP Dup ACK 60#1] 443→60628 [ACK] Seq=1 Ack=430 Win=61440 Len=0 TSval=723088283 TSecr=151522847
 62   4.277173 107.178.244.155 -> 10.0.18.51   TLSv1 242 Server Hello, Change Cipher Spec, Encrypted Handshake Message
 63   4.277230   10.0.18.51 -> 107.178.244.155 TCP 66 60628→443 [ACK] Seq=430 Ack=177 Win=131136 Len=0 TSval=151522866 TSecr=723088283
 64   4.277731   10.0.18.51 -> 107.178.244.155 TLSv1 460 Change Cipher Spec, Encrypted Handshake Message, Encrypted Handshake Message, Application Data, Application Data
 65   4.289171   10.0.18.51 -> 107.178.244.155 TCP 460 [TCP Retransmission] 60627→443 [PSH, ACK] Seq=430 Ack=177 Win=131136 Len=394 TSval=151522877 TSecr=4105085879
 66   4.297913 107.178.244.155 -> 10.0.18.51   TCP 66 443→60627 [ACK] Seq=177 Ack=824 Win=62464 Len=0 TSval=4105085943 TSecr=151522826
 67   4.302088 107.178.244.155 -> 10.0.18.51   TCP 78 [TCP Dup ACK 66#1] 443→60627 [ACK] Seq=177 Ack=824 Win=62464 Len=0 TSval=4105085947 TSecr=151522877 SLE=430 SRE=824
 68   4.335500 107.178.244.155 -> 10.0.18.51   TCP 66 443→60628 [ACK] Seq=177 Ack=824 Win=62464 Len=0 TSval=723088342 TSecr=151522866
 69   5.427198  10.0.17.138 -> 255.255.255.255 DB-LSP-DISC 234 Dropbox LAN sync Discovery Protocol
 70   5.427619  10.0.17.138 -> 10.0.255.255 DB-LSP-DISC 234 Dropbox LAN sync Discovery Protocol
 71   5.939259   10.0.18.46 -> 239.255.255.250 SSDP 216 M-SEARCH * HTTP/1.1 
 72   6.963158   10.0.18.46 -> 239.255.255.250 SSDP 216 M-SEARCH * HTTP/1.1 
 73   7.406147   10.0.18.51 -> 10.0.0.1     DNS 75 Standard query 0x514d A play.google.com
 74   7.407881 107.178.244.155 -> 10.0.18.51   TLSv1 263 Application Data
 75   7.407884 107.178.244.155 -> 10.0.18.51   TCP 66 443→60618 [FIN, ACK] Seq=198 Ack=1 Win=244 Len=0 TSval=3802688057 TSecr=151464250
 76   7.407885 107.178.244.155 -> 10.0.18.51   TCP 66 [TCP Out-Of-Order] 443→60618 [FIN, ACK] Seq=198 Ack=1 Win=244 Len=0 TSval=3802688086 TSecr=151464250
 77   7.407952   10.0.18.51 -> 107.178.244.155 TCP 66 60618→443 [ACK] Seq=1 Ack=198 Win=2046 Len=0 TSval=151525989 TSecr=3802688057
 78   7.408002   10.0.18.51 -> 107.178.244.155 TCP 66 60618→443 [ACK] Seq=1 Ack=199 Win=2046 Len=0 TSval=151525989 TSecr=3802688057
 79   7.408002   10.0.18.51 -> 107.178.244.155 TCP 66 [TCP Dup ACK 78#1] 60618→443 [ACK] Seq=1 Ack=199 Win=2046 Len=0 TSval=151525989 TSecr=3802688057
 80   7.408173     10.0.0.1 -> 10.0.18.51   DNS 91 Standard query response 0x514d A 172.217.10.110
 81   7.410136   10.0.18.51 -> 172.217.10.110 QUIC 1392 CID: 17963277348707473158, Seq: 1
 82   7.411000   10.0.18.51 -> 107.178.244.155 TLSv1 103 Encrypted Alert
 83   7.411044   10.0.18.51 -> 107.178.244.155 TCP 66 60618→443 [FIN, ACK] Seq=38 Ack=199 Win=2048 Len=0 TSval=151525992 TSecr=3802688057
 84   7.411813   10.0.18.51 -> 107.178.244.155 TCP 78 60629→443 [SYN, ECN, CWR] Seq=0 Win=65535 Len=0 MSS=1460 WS=64 TSval=151525992 TSecr=0 SACK_PERM=1
 85   7.420086   10.0.18.51 -> 51.255.150.206 TCP 54 60595→443 [ACK] Seq=1 Ack=1 Win=2047 Len=0
 86   7.427676 107.178.244.155 -> 10.0.18.51   TCP 78 [TCP Dup ACK 74#1] 443→60618 [ACK] Seq=199 Ack=1 Win=244 Len=0 TSval=3802688105 TSecr=151525989 SLE=38 SRE=39
 87   7.427680 107.178.244.155 -> 10.0.18.51   TCP 74 443→60629 [SYN, ACK] Seq=0 Ack=1 Win=60192 Len=0 MSS=1380 SACK_PERM=1 TSval=1741092375 TSecr=151525992 WS=256
 88   7.427758   10.0.18.51 -> 107.178.244.155 TCP 103 [TCP Retransmission] 60618→443 [FIN, PSH, ACK] Seq=1 Ack=199 Win=2048 Len=37 TSval=151526008 TSecr=3802688105
 89   7.427782   10.0.18.51 -> 107.178.244.155 TCP 66 60629→443 [ACK] Seq=1 Ack=1 Win=131328 Len=0 TSval=151526008 TSecr=1741092375
 90   7.427848 107.178.244.155 -> 10.0.18.51   TCP 78 443→60618 [ACK] Seq=199 Ack=39 Win=244 Len=0 TSval=3802688106 TSecr=151525992 SLE=38 SRE=39
 91   7.428021   10.0.18.51 -> 107.178.244.155 SSL 495 Client Hello
 92   7.434836   10.0.18.51 -> 51.255.150.206 TCP 54 60598→443 [ACK] Seq=1 Ack=1 Win=2047 Len=0
 93   7.442142 107.178.244.155 -> 10.0.18.51   TCP 66 [TCP Dup ACK 90#1] 443→60618 [ACK] Seq=199 Ack=39 Win=244 Len=0 TSval=3802688120 TSecr=151525992
 94   7.442188   10.0.18.51 -> 107.178.244.155 TCP 54 60618→443 [RST] Seq=39 Win=0 Len=0
 95   7.444778 172.217.10.110 -> 10.0.18.51   QUIC 1392 CID: 76, Seq: 254
 96   7.444785 172.217.10.110 -> 10.0.18.51   QUIC 73 CID: 0, Seq: 2
 97   7.445201   10.0.18.51 -> 172.217.10.110 QUIC 81 CID: 17963277348707473158, Seq: 2
 98   7.445316   10.0.18.51 -> 172.217.10.110 QUIC 70 CID: 17963277348707473158, Seq: 3
 99   7.445573   10.0.18.51 -> 172.217.10.110 QUIC 1009 CID: 17963277348707473158, Seq: 4
100   7.451655 107.178.244.155 -> 10.0.18.51   TCP 66 443→60629 [ACK] Seq=1 Ack=430 Win=61440 Len=0 TSval=1741092399 TSecr=151526008
101   7.451658 107.178.244.155 -> 10.0.18.51   TCP 66 [TCP Dup ACK 100#1] 443→60629 [ACK] Seq=1 Ack=430 Win=61440 Len=0 TSval=1741092399 TSecr=151526008
102   7.451659 107.178.244.155 -> 10.0.18.51   TLSv1 242 Server Hello, Change Cipher Spec, Encrypted Handshake Message
103   7.451719   10.0.18.51 -> 107.178.244.155 TCP 66 60629→443 [ACK] Seq=430 Ack=177 Win=131136 Len=0 TSval=151526031 TSecr=1741092400
104   7.452106   10.0.18.51 -> 107.178.244.155 TLSv1 460 Change Cipher Spec, Encrypted Handshake Message, Encrypted Handshake Message, Application Data, Application Data
105   7.457762   10.0.18.51 -> 51.255.150.206 TCP 54 60590→443 [ACK] Seq=1 Ack=1 Win=2500 Len=0
106   7.461837 172.217.10.110 -> 10.0.18.51   QUIC 62 CID: 0, Seq: 3
107   7.480365 172.217.10.110 -> 10.0.18.51   QUIC 719 CID: 0, Seq: 4
108   7.480369 172.217.10.110 -> 10.0.18.51   QUIC 250 CID: 0, Seq: 5
109   7.480611   10.0.18.51 -> 172.217.10.110 QUIC 70 CID: 17963277348707473158, Seq: 5
110   7.502075 107.178.244.155 -> 10.0.18.51   TCP 66 443→60629 [ACK] Seq=177 Ack=824 Win=62464 Len=0 TSval=1741092450 TSecr=151526031
111   7.505285 51.255.150.206 -> 10.0.18.51   TCP 66 [TCP ACKed unseen segment] 443→60595 [ACK] Seq=1 Ack=2 Win=243 Len=0 TSval=1427269340 TSecr=151481001
112   7.515439   10.0.18.51 -> 51.255.150.206 TCP 54 60594→443 [ACK] Seq=1 Ack=1 Win=2047 Len=0
113   7.535184 51.255.150.206 -> 10.0.18.51   TCP 66 [TCP ACKed unseen segment] 443→60598 [ACK] Seq=1 Ack=2 Win=243 Len=0 TSval=1427269347 TSecr=151481015
114   7.554453 51.255.150.206 -> 10.0.18.51   TCP 66 [TCP ACKed unseen segment] 443→60590 [ACK] Seq=1 Ack=2 Win=260 Len=0 TSval=1427269352 TSecr=151481036
115   7.604775 51.255.150.206 -> 10.0.18.51   TCP 66 [TCP ACKed unseen segment] 443→60594 [ACK] Seq=1 Ack=2 Win=252 Len=0 TSval=1427269365 TSecr=151481093
116   7.615503   10.0.18.51 -> 51.255.150.206 TCP 54 60596→443 [ACK] Seq=1 Ack=1 Win=2047 Len=0
117   7.703949 51.255.150.206 -> 10.0.18.51   TCP 66 [TCP ACKed unseen segment] 443→60596 [ACK] Seq=1 Ack=2 Win=252 Len=0 TSval=1427269390 TSecr=151481114
118   8.191956   10.0.18.46 -> 239.255.255.250 SSDP 216 M-SEARCH * HTTP/1.1 
119   8.192621  10.0.19.149 -> 255.255.255.255 DB-LSP-DISC 403 Dropbox LAN sync Discovery Protocol
120   8.193279  10.0.19.149 -> 10.0.255.255 DB-LSP-DISC 403 Dropbox LAN sync Discovery Protocol
121   8.193669  10.0.19.149 -> 255.255.255.255 DB-LSP-DISC 188 Dropbox LAN sync Discovery Protocol
122   8.194037  10.0.19.149 -> 10.0.255.255 DB-LSP-DISC 188 Dropbox LAN sync Discovery Protocol
